{
 "description": "timing probe lr_alu_sub in INT8",
 "format": "int8",
 "emulator_only": false,
 "max_cycles": 1000,
 "fault_enables": {},
 "registers": [
  {
   "name": "r_mask",
   "index": 0,
   "hex": "ffffffffffffffffffffffffffffffffffffffffffffffffffffffffffffffffffffffffffffffffffffffffffffffffffffffffffffffffffffffffffffffffffffffffffffffffffffffffffffffffffffffffffffffffffffffffffffffffffffffffffffffffffffffffffffffffffffffffffffffffffffffffffffffff"
  },
  {
   "name": "cr",
   "index": 2,
   "value": 5
  },
  {
   "name": "cr",
   "index": 3,
   "value": 100
  },
  {
   "name": "cr",
   "index": 15,
   "value": 128
  }
 ],
 "xmem": []
}
