{
 "description": "timing probe reshape_source in INT8",
 "format": "int8",
 "emulator_only": false,
 "max_cycles": 1000,
 "fault_enables": {},
 "registers": [
  {
   "name": "r_mask",
   "index": 0,
   "hex": "ffffffffffffffffffffffffffffffffffffffffffffffffffffffffffffffffffffffffffffffffffffffffffffffffffffffffffffffffffffffffffffffffffffffffffffffffffffffffffffffffffffffffffffffffffffffffffffffffffffffffffffffffffffffffffffffffffffffffffffffffffffffffffffffff"
  },
  {
   "name": "cr",
   "index": 2,
   "value": 83886080
  },
  {
   "name": "cr",
   "index": 15,
   "value": 128
  },
  {
   "name": "mult_res",
   "index": 0,
   "hex": "0100000002000000030000000400000005000000060000000700000008000000090000000a0000000b0000000c0000000d0000000e0000000f000000100000001100000012000000130000001400000015000000160000001700000018000000190000001a0000001b0000001c0000001d0000001e0000001f000000200000002100000022000000230000002400000025000000260000002700000028000000290000002a0000002b0000002c0000002d0000002e0000002f000000300000003100000032000000330000003400000035000000360000003700000038000000390000003a0000003b0000003c0000003d0000003e0000003f000000400000004100000042000000430000004400000045000000460000004700000048000000490000004a0000004b0000004c0000004d0000004e0000004f000000500000005100000052000000530000005400000055000000560000005700000058000000590000005a0000005b0000005c0000005d0000005e0000005f000000600000006100000062000000630000006400000065000000660000006700000068000000690000006a0000006b0000006c0000006d0000006e0000006f000000700000007100000072000000730000007400000075000000760000007700000078000000790000007a0000007b0000007c0000007d0000007e0000007f00000080000000"
  }
 ],
 "xmem": []
}
