{
 "description": "ST.AAQ in FP32",
 "format": "fp32",
 "emulator_only": true,
 "max_cycles": 1000,
 "fault_enables": {},
 "registers": [
  {
   "name": "r_mask",
   "index": 0,
   "hex": "ffffffffffffffffffffffffffffffffffffffffffffffffffffffffffffffffffffffffffffffffffffffffffffffffffffffffffffffffffffffffffffffffffffffffffffffffffffffffffffffffffffffffffffffffffffffffffffffffffffffffffffffffffffffffffffffffffffffffffffffffffffffffffffffff"
  },
  {
   "name": "post_aaq_reg",
   "index": 0,
   "hex": "76fdeb4b9119c4a3bb1115ff20d7968fa21b51bf4909840ebce311e12ea243f6636f3bda2f284fe5223c77c934f1c0340abd3fc3b91895133cc73f5db5d26b9ab86a09337c08efd2e687b5c9ada345ff2f6567a19e00d546c7ead032c008ad081f2e52fe924154a848cf554472a7233ad7bb16cb7ddfd200c58fdb864f1e666465778b7874aa02f36b14e09646abef961ea6894a9812d9a886b976a09b9d5dd2efb4818aae8a7cc00204169aee547b9f84c7971703b6c0a092bf43af6f4536fdfdcc7ab77f36d700757970d89b37166c4b2ca138eab19b1651ea9117950b86336b21bbc0c848285a6544f72779e0677ed1889bf75aacb83939ebabf722ac64379df12cc7a9d4945acad2b88b7fc35ff0ff03451dab3d5c8bbc65e2675ec349d5449574ef7fe6177fe15a5a53ca448b2c27a71af9b68dead3d1b7c608028b81f30f70d458844fe2cecd51f52fcee22de91a90009cdf8a80b4c364d6d6210c16f68e5da9c3f6e2b44f579240454b26c2ae227d11b134b1069b50938e7c72bbc87afaa59a89dd687bc4e6e0382b47bedd833c25e1474f75de21a23fb8c2ebde16c2165ea9371d264a3cd6a54fcd0d85f2feb57ddb5c758e4b156dd95c2ae4542a380832624fe50a565f28c9fd2e58c5439ab401e74f1e099067dd9aec1eb645fc1d0e3bcb6bfe0009d9b8e1b1a3ef4d6d6d98f22ed7c55fe36fc0e442555c885a6e"
  },
  {
   "name": "lr",
   "index": 1,
   "value": 1
  },
  {
   "name": "lr",
   "index": 2,
   "value": 2
  },
  {
   "name": "lr",
   "index": 3,
   "value": 3
  },
  {
   "name": "lr",
   "index": 4,
   "value": 5
  },
  {
   "name": "lr",
   "index": 6,
   "value": 128
  },
  {
   "name": "lr",
   "index": 7,
   "value": 3
  },
  {
   "name": "cr",
   "index": 2,
   "value": 1
  },
  {
   "name": "cr",
   "index": 3,
   "value": 4
  },
  {
   "name": "cr",
   "index": 4,
   "value": 2
  },
  {
   "name": "cr",
   "index": 5,
   "value": 7
  },
  {
   "name": "cr",
   "index": 6,
   "value": 128
  },
  {
   "name": "cr",
   "index": 7,
   "value": 4294967294
  },
  {
   "name": "cr",
   "index": 8,
   "value": 100
  },
  {
   "name": "cr",
   "index": 9,
   "value": 3
  },
  {
   "name": "cr",
   "index": 15,
   "value": 128
  }
 ],
 "xmem": []
}
