{
 "description": "AGG.MAX.FIRST in E4",
 "format": "e4",
 "emulator_only": false,
 "max_cycles": 1000,
 "fault_enables": {},
 "registers": [
  {
   "name": "r_mask",
   "index": 0,
   "hex": "ffffffffffffffffffffffffffffffffffffffffffffffffffffffffffffffffffffffffffffffffffffffffffffffffffffffffffffffffffffffffffffffffffffffffffffffffffffffffffffffffffffffffffffffffffffffffffffffffffffffffffffffffffffffffffffffffffffffffffffffffffffffffffffffff"
  },
  {
   "name": "lr",
   "index": 1,
   "value": 1
  },
  {
   "name": "lr",
   "index": 2,
   "value": 2
  },
  {
   "name": "lr",
   "index": 3,
   "value": 3
  },
  {
   "name": "lr",
   "index": 4,
   "value": 5
  },
  {
   "name": "lr",
   "index": 6,
   "value": 128
  },
  {
   "name": "lr",
   "index": 7,
   "value": 3
  },
  {
   "name": "cr",
   "index": 2,
   "value": 1
  },
  {
   "name": "cr",
   "index": 3,
   "value": 4
  },
  {
   "name": "cr",
   "index": 4,
   "value": 2
  },
  {
   "name": "cr",
   "index": 5,
   "value": 7
  },
  {
   "name": "cr",
   "index": 6,
   "value": 128
  },
  {
   "name": "cr",
   "index": 7,
   "value": 4294967294
  },
  {
   "name": "cr",
   "index": 8,
   "value": 100
  },
  {
   "name": "cr",
   "index": 9,
   "value": 3
  },
  {
   "name": "cr",
   "index": 15,
   "value": 128
  },
  {
   "name": "mult_res",
   "index": 0,
   "hex": "dc7ee2bfe29deac0b80b02be56a7e7c0e50160407a5551c0b752a7c0cca5a54027481dbf4bf86b403ab46ec01ba7eac04f51a83ff96745405da38940a384fc3ebeeab03f2a5cf53f9d241cc0dc3ac6c0f17f56c0a254ee3f3a65da3ff1fd76c0ee4bd23d66ce19c0b609c240fc5dd340a102b34093cc45c08d8cd6bf38ad3ec0d698b440cab41240f933a840f47a10400340f4bf49fb6a3f644477c02b51f8c0f6fedc40defd7e40671e8fbdf196c140a0f500bf393ea33e28bcf040f56ad840c60122c0b6f8ed406280d5c06c54df3f2cd7e2c0b6c3f140fbf9e840b98bc440e5be61bf0cd01fc0fb54d5c061e29540f5d44b3f01643ac0a817fa3fd5ce493ff79339c0265589c043bdc9c0a2698ec09ad3f440532296c03a5fbb4092773440d7c9733f961be4c0fca9fd400abc99405229fe3f5336f0bd335c8d3ee36489401af7d540738072405c1c06408eba15c07a3645bf8780c1c0388d8f405401b3c0925128405377dc405b494f407cdccdc043d38c40ae8d2a405b5dfec08802493f8e0952400b01c1c03d6226bf6c8d123fa0a4994031f83940b5ab01bfb80d893fd4091ac09486c740fad426c0e3b7a9c05109a640f8bfcbbf1896bec055e77c40309dbc4047221fc05688c540682dde40c55aeabfe90e22bf2ddffabf0246bf4054c6dcc0d7334bbf1aa2aac034c231c07a592dc049e68ac08befd9c02ad19740"
  }
 ],
 "xmem": []
}
