{
 "description": "ACC.STRIDE in FP32",
 "format": "fp32",
 "emulator_only": true,
 "max_cycles": 1000,
 "fault_enables": {},
 "registers": [
  {
   "name": "r_mask",
   "index": 0,
   "hex": "ffffffffffffffffffffffffffffffffffffffffffffffffffffffffffffffffffffffffffffffffffffffffffffffffffffffffffffffffffffffffffffffffffffffffffffffffffffffffffffffffffffffffffffffffffffffffffffffffffffffffffffffffffffffffffffffffffffffffffffffffffffffffffffffff"
  },
  {
   "name": "lr",
   "index": 1,
   "value": 1
  },
  {
   "name": "lr",
   "index": 2,
   "value": 2
  },
  {
   "name": "lr",
   "index": 3,
   "value": 3
  },
  {
   "name": "lr",
   "index": 4,
   "value": 5
  },
  {
   "name": "lr",
   "index": 6,
   "value": 128
  },
  {
   "name": "lr",
   "index": 7,
   "value": 3
  },
  {
   "name": "cr",
   "index": 2,
   "value": 1
  },
  {
   "name": "cr",
   "index": 3,
   "value": 4
  },
  {
   "name": "cr",
   "index": 4,
   "value": 2
  },
  {
   "name": "cr",
   "index": 5,
   "value": 7
  },
  {
   "name": "cr",
   "index": 6,
   "value": 128
  },
  {
   "name": "cr",
   "index": 7,
   "value": 4294967294
  },
  {
   "name": "cr",
   "index": 8,
   "value": 100
  },
  {
   "name": "cr",
   "index": 9,
   "value": 3
  },
  {
   "name": "cr",
   "index": 15,
   "value": 128
  },
  {
   "name": "mult_res",
   "index": 0,
   "hex": "41a1cc3fbce6ce406555a4c0defb864007f334c02e1dcec0bb1765c0e50cbd40358f10c0f1e4e14014f055409e41c73ed2d8fb406710fbc06f1977c081bd043ffe683a4060849cc0ec005dc07df08840c9a4154062d1e9c0de09d4408a38b1c0a4b61dc0aa006e3fb301d9c00f98c8bddf6c4cc0d07407bf7f55b1c0e8368840043069c047ba9f40500aebc0333ad8c0adb62140dabae2c0dd2faebfa14eb0c02bcc0640590892c0dc0aa5c03840fac08c1c6940f8a4bec039f3ad400a939140ef94744099ff20c025a2bac018aef440c4a179403e2235402b54e9c0413cef409566ce403cd1bd40f2a1a4c084b3a640a772e540dd0c9ec0bbea0cc0e4d75dc06660de40c6455ac0ca40ed4016c8df406342dfc05e0fb3c08c27bac065ef13bebeb880400b59f4403a16d53f4ddc84c0688c4f3fb9ae7cbf0bc1b240c193b540b55d994014ed55c0f22255c0c51924400ff17abe0e27ef40d158f7c02d38b13eb135003f361d83c00b7aba40ab4e043f496603bf9cb05540e0ccb4bfb66a9cc0abc93ec0297479c09ccd6ac05d838fc046b58fc04b4451c0e3ab9740226fa54037d18d406b0d6bc0d78dbd4058bfdd40a3f9f83ffac6243dd05065c0b252e3c09493a3be5080e9c04292c240b2922840f6c5a5c0f398c0bfea4c89bfd6e753c04f4020400750d3c0c55602c04a55fac03479bdc0a2cee3c0a0b95bc04e0a61c0"
  }
 ],
 "xmem": []
}
