{
 "description": "ST.AAQ in INT8",
 "format": "int8",
 "emulator_only": false,
 "max_cycles": 1000,
 "fault_enables": {},
 "registers": [
  {
   "name": "r_mask",
   "index": 0,
   "hex": "ffffffffffffffffffffffffffffffffffffffffffffffffffffffffffffffffffffffffffffffffffffffffffffffffffffffffffffffffffffffffffffffffffffffffffffffffffffffffffffffffffffffffffffffffffffffffffffffffffffffffffffffffffffffffffffffffffffffffffffffffffffffffffffffff"
  },
  {
   "name": "post_aaq_reg",
   "index": 0,
   "hex": "fac0b363cf14f9a2604887388bbe80f90938104ea8c2c87852e027d7343d5f3a626a0bd581b376418e8c3c6d1527731c9de14dc2e0b34da71303d808d30fa00d2e4f5a5c65e8f600093f93822d0a29c74750b6100f316d0a87f6e1872fcb017e0fc869ce9c5d7626e9bc05fb47a6e4865d0082b123b410324d1954bdc9f73a333b38811eaf85686c94cdb19ff384ffdba1fe80abb85a34a285d881e2147fbcdabac1dc3d1c499db102ed26120c33e1abb02ac3984ee3223ddc7da8f262ac0457fa1b535492d82c46dba88612318264d110badd496e50a5acdff9b1957a14f5ad4d9fb26f22b64bebea69687c3bc7469b3698946fd50335201bc710d8aecd2656b292ddda73f7b0a6a49e0dd37641cd3d92a90288e0513debcc8108704262ee254d1aef73a979953a6aed42052aece8a1a2c3cee2dbf1bd0071d361796cfda3e63b8646cfde5478def30f24383d54ba2d862deca15faa77ea07d3233a3cf08f341ef4f80f668c1f3f5d1c2f173744b17f090268db97b2c0ce7d1e7dfc7165d95f923911910c5600340f8a0a42662d6404762706f574778be41e694b851f8c53ef1026b346a2a70b87b796e28dd71bc5d0ae0c6827887c1aeff728e80795fe93fd1ca75704ba9a09ca23d1d5b5813b7d289b59f38a52526d171d361bea3f102e34aa3bf13bdd0fec7182f380f4b1fee44998a04190cd493e5ed2f252f3d8d34e45"
  },
  {
   "name": "lr",
   "index": 1,
   "value": 1
  },
  {
   "name": "lr",
   "index": 2,
   "value": 2
  },
  {
   "name": "lr",
   "index": 3,
   "value": 3
  },
  {
   "name": "lr",
   "index": 4,
   "value": 5
  },
  {
   "name": "lr",
   "index": 6,
   "value": 128
  },
  {
   "name": "lr",
   "index": 7,
   "value": 3
  },
  {
   "name": "cr",
   "index": 2,
   "value": 1
  },
  {
   "name": "cr",
   "index": 3,
   "value": 4
  },
  {
   "name": "cr",
   "index": 4,
   "value": 2
  },
  {
   "name": "cr",
   "index": 5,
   "value": 7
  },
  {
   "name": "cr",
   "index": 6,
   "value": 128
  },
  {
   "name": "cr",
   "index": 7,
   "value": 4294967294
  },
  {
   "name": "cr",
   "index": 8,
   "value": 100
  },
  {
   "name": "cr",
   "index": 9,
   "value": 3
  },
  {
   "name": "cr",
   "index": 15,
   "value": 128
  }
 ],
 "xmem": []
}
