{
 "description": "timing probe acc_store_r_acc in INT8",
 "format": "int8",
 "emulator_only": true,
 "max_cycles": 1000,
 "fault_enables": {},
 "registers": [
  {
   "name": "r_mask",
   "index": 0,
   "hex": "ffffffffffffffffffffffffffffffffffffffffffffffffffffffffffffffffffffffffffffffffffffffffffffffffffffffffffffffffffffffffffffffffffffffffffffffffffffffffffffffffffffffffffffffffffffffffffffffffffffffffffffffffffffffffffffffffffffffffffffffffffffffffffffffff"
  },
  {
   "name": "r_acc",
   "index": 0,
   "hex": "0100000001000000010000000100000001000000010000000100000001000000010000000100000001000000010000000100000001000000010000000100000001000000010000000100000001000000010000000100000001000000010000000100000001000000010000000100000001000000010000000100000001000000010000000100000001000000010000000100000001000000010000000100000001000000010000000100000001000000010000000100000001000000010000000100000001000000010000000100000001000000010000000100000001000000010000000100000001000000010000000100000001000000010000000100000001000000010000000100000001000000010000000100000001000000010000000100000001000000010000000100000001000000010000000100000001000000010000000100000001000000010000000100000001000000010000000100000001000000010000000100000001000000010000000100000001000000010000000100000001000000010000000100000001000000010000000100000001000000010000000100000001000000010000000100000001000000010000000100000001000000010000000100000001000000010000000100000001000000010000000100000001000000010000000100000001000000010000000100000001000000"
  },
  {
   "name": "cr",
   "index": 2,
   "value": 16
  },
  {
   "name": "cr",
   "index": 15,
   "value": 128
  },
  {
   "name": "mult_res",
   "index": 0,
   "hex": "0700000007000000070000000700000007000000070000000700000007000000070000000700000007000000070000000700000007000000070000000700000007000000070000000700000007000000070000000700000007000000070000000700000007000000070000000700000007000000070000000700000007000000070000000700000007000000070000000700000007000000070000000700000007000000070000000700000007000000070000000700000007000000070000000700000007000000070000000700000007000000070000000700000007000000070000000700000007000000070000000700000007000000070000000700000007000000070000000700000007000000070000000700000007000000070000000700000007000000070000000700000007000000070000000700000007000000070000000700000007000000070000000700000007000000070000000700000007000000070000000700000007000000070000000700000007000000070000000700000007000000070000000700000007000000070000000700000007000000070000000700000007000000070000000700000007000000070000000700000007000000070000000700000007000000070000000700000007000000070000000700000007000000070000000700000007000000070000000700000007000000"
  }
 ],
 "xmem": []
}
