{
 "description": "timing probe acc_mult_res_add in FP32",
 "format": "fp32",
 "emulator_only": true,
 "max_cycles": 1000,
 "fault_enables": {},
 "registers": [
  {
   "name": "r_cyclic_wide_debug",
   "index": 0,
   "hex": "0000404000004040000040400000404000004040000040400000404000004040000040400000404000004040000040400000404000004040000040400000404000004040000040400000404000004040000040400000404000004040000040400000404000004040000040400000404000004040000040400000404000004040000040400000404000004040000040400000404000004040000040400000404000004040000040400000404000004040000040400000404000004040000040400000404000004040000040400000404000004040000040400000404000004040000040400000404000004040000040400000404000004040000040400000404000004040000040400000404000004040000040400000404000004040000040400000404000004040000040400000404000004040000040400000404000004040000040400000404000004040000040400000404000004040000040400000404000004040000040400000404000004040000040400000404000004040000040400000404000004040000040400000404000004040000040400000404000004040000040400000404000004040000040400000404000004040000040400000404000004040000040400000404000004040000040400000404000004040000040400000404000004040000040400000404000004040000040400000404000004040000000000000000000000000000000000000000000000000000000000000000000000000000000000000000000000000000000000000000000000000000000000000000000000000000000000000000000000000000000000000000000000000000000000000000000000000000000000000000000000000000000000000000000000000000000000000000000000000000000000000000000000000000000000000000000000000000000000000000000000000000000000000000000000000000000000000000000000000000000000000000000000000000000000000000000000000000000000000000000000000000000000000000000000000000000000000000000000000000000000000000000000000000000000000000000000000000000000000000000000000000000000000000000000000000000000000000000000000000000000000000000000000000000000000000000000000000000000000000000000000000000000000000000000000000000000000000000000000000000000000000000000000000000000000000000000000000000000000000000000000000000000000000000000000000000000000000000000000000000000000000000000000000000000000000000000000000000000000000000000000000000000000000000000000000000000000000000000000000000000000000000000000000000000000000000000000000000000000000000000000000000000000000000000000000000000000000000000000000000000000000000000000000000000000000000000000000000000000000000000000000000000000000000000000000000000000000000000000000000000000000000000000000000000000000000000000000000000000000000000000000000000000000000000000000000000000000000000000000000000000000000000000000000000000000000000000000000000000000000000000000000000000000000000000000000000000000000000000000000000000000000000000000000000000000000000000000000000000000000000000000000000000000000000000000000000000000000000000000000000000000000000000000000000000000000000000000000000000000000000000000000000000000000000000000000000000000000000000000000000000000000000000000000000000000000000000000000000000000000000000000000000000000000000000000000000000000000000000000000000000000000000000000000000000000000000000000000000000000000000000000000000000000000000000000000000000000000000000000000000000000000000000000000000000000000000000000000000000000000000000000000000000000000000000000000000000000000000000000000000000000000000000000000000000000000000000000000000000000000000000000000000000000000000000000000000000000000000000000000000000000000000000000000000000000000000000000000000000000000000000000000000000000000000000000000000000000000000000000000000000000000000000000000000000000000000000000000000000000000000000000000000000000000000000000000000000000000000000000000000000000000000000000000000000000000000000000000000000000000000000000000000000000000000000000000000000000000000000000000000000000000000000000000000000000000000000000000000000000000000000000000000000000000000000000000000000000000000000000000000000000000000000000000000000000000000000000000000000000000000000000000000000000000000000000000000000000000000000000000000000000000000000000000000000000000000000000000000000000000000000000000000000000000000000000000000000000000000000000000000000000000000000000000000000000000000000000000000000000000000000000000000000000000000000000000000000000000000000000000000000000000000000"
  },
  {
   "name": "r_mask",
   "index": 0,
   "hex": "ffffffffffffffffffffffffffffffffffffffffffffffffffffffffffffffffffffffffffffffffffffffffffffffffffffffffffffffffffffffffffffffffffffffffffffffffffffffffffffffffffffffffffffffffffffffffffffffffffffffffffffffffffffffffffffffffffffffffffffffffffffffffffffffff"
  },
  {
   "name": "cr",
   "index": 14,
   "value": 328
  },
  {
   "name": "cr",
   "index": 15,
   "value": 4224
  },
  {
   "name": "mult_res",
   "index": 0,
   "hex": "0000803f0000803f0000803f0000803f0000803f0000803f0000803f0000803f0000803f0000803f0000803f0000803f0000803f0000803f0000803f0000803f0000803f0000803f0000803f0000803f0000803f0000803f0000803f0000803f0000803f0000803f0000803f0000803f0000803f0000803f0000803f0000803f0000803f0000803f0000803f0000803f0000803f0000803f0000803f0000803f0000803f0000803f0000803f0000803f0000803f0000803f0000803f0000803f0000803f0000803f0000803f0000803f0000803f0000803f0000803f0000803f0000803f0000803f0000803f0000803f0000803f0000803f0000803f0000803f0000803f0000803f0000803f0000803f0000803f0000803f0000803f0000803f0000803f0000803f0000803f0000803f0000803f0000803f0000803f0000803f0000803f0000803f0000803f0000803f0000803f0000803f0000803f0000803f0000803f0000803f0000803f0000803f0000803f0000803f0000803f0000803f0000803f0000803f0000803f0000803f0000803f0000803f0000803f0000803f0000803f0000803f0000803f0000803f0000803f0000803f0000803f0000803f0000803f0000803f0000803f0000803f0000803f0000803f0000803f0000803f0000803f0000803f0000803f0000803f0000803f0000803f0000803f0000803f"
  }
 ],
 "xmem": []
}
