{
 "description": "ST.AAQ in E4",
 "format": "e4",
 "emulator_only": false,
 "max_cycles": 1000,
 "fault_enables": {},
 "registers": [
  {
   "name": "r_mask",
   "index": 0,
   "hex": "ffffffffffffffffffffffffffffffffffffffffffffffffffffffffffffffffffffffffffffffffffffffffffffffffffffffffffffffffffffffffffffffffffffffffffffffffffffffffffffffffffffffffffffffffffffffffffffffffffffffffffffffffffffffffffffffffffffffffffffffffffffffffffffffff"
  },
  {
   "name": "post_aaq_reg",
   "index": 0,
   "hex": "bec55cce0bdde4ecd5dcd143bdab56068eaa384e97b69d1257d74d929ac52b10336db78e1e83b74a3937ab1b751013f94a0abca7747586b4be01742ba8476081d18207e00e30d6f7cdc42be37461db824f0f0deff0a1716f318b356ebe9593968e04745108042367ea6f19c13ccfcb9979f619dfabfb0f3e565c82d453ab8030a18e99f0e599693ac8537df2dfd01170c64868b74c75e7cb5761129f629d3d51faa845b53ea0c43de9f0b60b9c455ebd1b2ee90b1babf3462b99196fc83bab930b81c9da89963456782999ee4c25857511d1a9a842417ce24e4880332b61c83e45e9005805c33e323d31cf5dffbde9e67bbd5a7b83b5801916a43aaf5ee97a39a7a79e9e656445b10e83142e813f584d0b3ad99d718698e7be9e66020d303bb55864892f1079ab73c6a2e69f31190aa54eaf87a3f476fdceae37028ff0bcb430c262e8866ed757e51c75e3360cb43537dbea42f91922421b7f545fbe765489c2787698408024d217504ca2138764b9dc494b41ce8d910bfa9965a49e19597a5b74e43d9c85daff4db07b16c6ffb0a66ea16d419663566b346e9c844b74300191fb59816604cd247d7efc4b6ca23b171e58feec02a1389f08365312d0e0aeefe32701851a38aa97ed2d707bb5e967421db506b24393b6bb851c0de563a56d6b1cc1fa31954f449345ee4a15edc22e848314f445e62e63300f53e74fbef426beb1"
  },
  {
   "name": "lr",
   "index": 1,
   "value": 1
  },
  {
   "name": "lr",
   "index": 2,
   "value": 2
  },
  {
   "name": "lr",
   "index": 3,
   "value": 3
  },
  {
   "name": "lr",
   "index": 4,
   "value": 5
  },
  {
   "name": "lr",
   "index": 6,
   "value": 128
  },
  {
   "name": "lr",
   "index": 7,
   "value": 3
  },
  {
   "name": "cr",
   "index": 2,
   "value": 1
  },
  {
   "name": "cr",
   "index": 3,
   "value": 4
  },
  {
   "name": "cr",
   "index": 4,
   "value": 2
  },
  {
   "name": "cr",
   "index": 5,
   "value": 7
  },
  {
   "name": "cr",
   "index": 6,
   "value": 128
  },
  {
   "name": "cr",
   "index": 7,
   "value": 4294967294
  },
  {
   "name": "cr",
   "index": 8,
   "value": 100
  },
  {
   "name": "cr",
   "index": 9,
   "value": 3
  },
  {
   "name": "cr",
   "index": 15,
   "value": 128
  }
 ],
 "xmem": []
}
