{
 "description": "MULT.RC.VE in FP32",
 "format": "fp32",
 "emulator_only": true,
 "max_cycles": 1000,
 "fault_enables": {},
 "registers": [
  {
   "name": "r_wide_debug",
   "index": 0,
   "hex": "3e9b8540a6329bc0e00abe3ffb2ba13f3719fdc03eeeeec016d7fe403338604012293340d41fbdc0a299b740a41874c0556a30c0f352a7bef208aa4079e5a640eda2d93fef85fbc09259a74022a0de40d45bc9c0193fef40f0f9a9c0d59f89c061f364be9e9a90c09e5e3e3ffc8de3bfb442bc4024f3c2c0ae4b6fc0a39bed402d95a140e6906ec035c513bfc85d373f1cfffec0323769c08f59243fecd752beb0ac98c0a8aa02c04306c64046ea2dbf1eaa7040d2f0dec01c9d703f83224ec0d723a43f508f9fc07d6d923f5b23f240f575ad405c46a13f2521853e6632c1400097a440b7f6da4069c87b3f5d31c3bf31d4babf8e7acd4013facabfa668e3bfc9eb99bf71858e40fde6edc01b97673f5c6184c0d3739cc04e8684404e382a40d592a9c07008a54089c7bdbfcfe9d4c0defb524046d1fac0d24fb9c0c5ce6dbe54ffe6c0f23099c0bc00d340f1d39440d6218c3f2e58e33caef86540dc5343c0c0a1d2403061cbc05228e940a459bd401c3c88c0a9593a407f1ec340e3400c40a024db407214d8c0e93ae53deae793c0cf446ac09382cc4027d9d1c0848edec05794f24088a2a4c0c501fcc07398af4034a76240a160c640722a65bf2ec7ccbf55104e3e16363740a417433f31a285c026c3d6c0eca2c8bffba30d4088a88c3fbdf78740643dbfc04aadaa40ec84fbc0be72bd400b52233eac269b409ce6853d"
  },
  {
   "name": "r_wide_debug",
   "index": 1,
   "hex": "4dff55c032f8d0c047a3d640db9bcf404fa2ec40592ad340a9f28f40b590914043bc9ec07e55e1401092cbc08c62e7409171d6c0f6f0564068c58540db8dfa40f951d640d9d96940c4a1f2c0cfb6a5409a08cf3d2d31373d7bf0394033f4a5c04ce5844014bda8c0a2b71d40251cbe4025cab5407e049140e50ac3c07da90f407a10853f2624f63e34c4c8c0568cd93f13a9c4405d0088405a94d5c05b3971c0e3af01bfe2bc983f1dc281400c978ac0bd56f33f0d44a1c0da3fc43fdad4babec0a6c4409501d540ce26fac041f0bd3e5126f1408465cf40906abec0ad3dfcc09147aec0d986e6c01f438e40118cc3c04299ce40827ad140f87419c0dad498c0171f91c00c09c540a90a7bc0eceb9ac08b2982c0da9abf3f9e911d40c66be14032cbcb40c3e2b840c88794408c2ce9408f527b407fee84c0a97f3040aa63ba403b99974096af1fc0b0a78a40c263af40ac36ca40445c9a3ebc2330c0a168dbbf12a1883f25d6f540a92c73c04f1a3a4030225bbf336bbec082caddc0aed78640fce402402ecfdac0cb39f23ed3ccab3f6d41ed40c12765c0b4ea50c00d11b440c4288b40bfa8bec018f026bf000d86408cb76340040ee1400386ad3fc56c5c406e3d9c4092fa1f40cf69e24028222ec0fbb8d9bf66ccaa40be7b93c0a65a893e051067402fa939be0de7053fe835994074d0e94095e6cbc0e49465c089929f40"
  },
  {
   "name": "r_cyclic_wide_debug",
   "index": 0,
   "hex": "e9415c409ea300c0f4a018c00d90ae402939aac024802a3f1a2f43bfd87d83bed2008bbf779111c0229de5c0dc7ef6400f5cbd4051e97540c8d6e3bf477689bf50edc4c0ea80494048b398c0835a08c016328bbff73f9340efc1bcbf220377c0d44abb4026e781c0a28af9c09940b340b7fcb140d7d401c02f29c540ffdc8ac0a52c94409196f840452465401826babfd87c70c08c848bc08b1f6d3f15308e40b0e493403fe38d3ed1aa3140385131c028811640653923bee768e4c0c461e9c039809c405b8289c01ebef43fb10ad03f77f6dc4024639ec0a42a44c0b7e9a340ea0267bfca12aabf9db1e53dcddec7c0317d04c0cae57f4021d6adbf85a6603e1d16693fe248f1c0f40139c0844e32c07e23dd409cc6b140d3c45640c31ed2c0e8c7a6bf1372803fc2f1fbc0dc7681bf3653e33fbafccbc0680c474026b98a3f17e90fc09e351d40bb8bd9c01fde8dc03edc46401c762940f3b794c03dc3e340c6b71d400717b33f5e60f740e701e1406da3b4c0e81bcbc02a9683c0f87149c058c6e03ff76c2340b213f940b8089c4074bf94bf2e7e44c04406cd3f9b3be8bf4b95c4c05e55ed402d16063f612cf64032ca9cc02933afbeb3d4e33f1b011bbf69ca9e40269efdbe07eeb8c07cb592c0ea4788409bda373ee0ffa9c003d87bc025c08ec0c735ecc05cb104c040f89dc0e14a8a400fc570c0e13f89bf4b47944048649c402552e3be8bf8593e7664f8409a01fabf9781d0bf1b4a114076f7efc00cf543bef18ce340792de540a180e4c0cc95a23f8a71cfc0cc41a1404376813eae2d50c09fc144bf07baa140259b6f40a8a6b24095718ac0d421de40d5ae18c00f6a21bdc826413f1b3e3c40590a1fbf05d19240c437cabeb13a1c402b97274096ab95406490b1c0587ec9bf54616bc0dbb977c0c4d09bc09440b540da39c9c0ca3cb140f272e6c0c2dfadc0cc8eff403ba1e840dc23dec0f060b640df63f040190cedbf268bfe406c44f8bf825258c0e7d49cc08000b8c017e0a63ff5aa1f3f91ef84beb4614fc0a4768a40ab0f26403b5edac0dea7bbc030eaebc02edf76c0b3f6dbc096e8fbc03f6db83f7f11f73fe26c0cc0fa4ab140fc6691bf4995a94071ba5c40ef31fe3d14150d4035ffad40d04cc93e1195b1403840e4bf2d22d4407d9f6ac0b6ec993f9abb1dbf1a87d3bf79d6f93f3c9152c02d9c0a405ae2a8403669013ed1d54b40f516b740a2dbbb407098cf3ee25eb63fa7b049c0dec0d4406f8ac9bf45dfc33fcc588c40fe4ceb405cc77a40be8eccc0dff33f3f2f78a4401dfef940f3d5bdbf757aa6c07821ac3e87777940a9e0e43d07f31dc0f9c9b33f6b66bac057ae0940f0f69440982a9cbf88fb943e06ecad40344255403de98cc06056f2be2d0c563f430c1b40edcdaa3f75b3a640535ed63e7bcf7ac009136b4051593fc0a8228d3fcff3c8bf459887c0f79b973ff7ab8740f42ff640829b9dbf45028fc0e5dd52402fcabac03b4803c02544c3c0a5c09bc0668b3940f3651ac09cd236c0f05349c06be168c0dcc48440b41951c07878bb406891e0c0fe92e840c6047cc0705c323fb9ff18400edb9d40573858c0f34d30be43f2be3dfaf632c0c48317401b0596405d796b400131d140df2f9740ec46ce3fbb65b8c0a6c09a407d00534036840e4039a198c059d3fe3d7c0cf2c043073fc0838b88bf8ae748c07356953f7a41423f05f1e1c097a93040355b604087bc773d7019a640cc37fac0a196c040099f43c00239b7c01825fa4006a07840b7bf8ec0da0353c04413f53fbe49de3fe5b3a6409da0a93fd28b9040eb51b03ea8c9bcc0b5c4d1c05c4ba74088b042409eae2d3f2067db3f734dba40b99fa2401b2404407ab5f6c019a383409a1700c022afaa40f8565b3eec4d01c0101a90402f8cb4c02606e7c0fc3087c01adebcc05fa3d6400a7ee5400f1bedc001d2fa3f13c5ad4005d54dc0991fdfc017d68fc0a88174400fb0b0400f4acfc04e91b0bf305941c0e4130cbf3eb72d4018e1d8c056062240ca0bc5beeb6dd1407e59d43f1057fcc0b2583f4050a898bf7888ab404b2097c0b89e0440e10ba6c0ed96b1408b9bf3bfa7f9f84066c9833ea309c3c052dd2b4048fcd53fddeed8c054a7cf402846b8c06122acbf71651dc0c4b9ec400cae9040b2ac984070783ec0649a1740bdb4f9c037a137be74f9fd406db423bf7d5efd40dae7b740472c9740e1661ec07c33fc4096ca8e40e23b18bf3551c5408206df3f1ed7c940eae6b13f01a6e84081e4104035bdb6407208a03fccf787c0aecccf40d9ee08c033c6903f38e01dc0601e48bf9a51514010efc8c082fb9dbfa2997640674892c0d7e8d4c08c0b4c40a8321dbfaff27d40b82d86409a174ac06beff9400336a6c03943b6c0b33805c05586b5408eff28c01f25a7c0778f933f478fbf40e72afdbe851d8ec0983cdd40d6cfaac070ae84c020fd883d3fda87c06e770840e66ca24042236f40a3ff0d404b65ba407b34b1c0afc8bac0df317f40dbca05c070c607c065c3b53e39f06140e0f583bedfce24c0b6bf7cc04b99893ef5f6cec0e3f988404ba5bb3fe837d84049a7f3c0168697c0c355b2c055a4de40be2bc5c0b6344940969380409653f5c0927d71c0fd9277bfbeafe1c0c5ebd9401ce880c0247ec3bf0da2613e471716c033bf84407a8c8540e9d7b23f2a0e01409f54e3c05577f6c09aadf7c0d5b7a8401bdf4840db4e8f40b18abf4080948cc020ff3a406ce444c0c81d53c06bbb543fa4b2e040e502bf40369a8e40cbec06c06cecb53e3e9edcbf20cf483fd21aa440a08da5c01d2bbbbf6e0a70c0a70038bf1aae984055a6383fed6e0bc02a10a8400ae680bfd2339040635bd440"
  },
  {
   "name": "r_meta",
   "index": 0,
   "hex": "7d00"
  },
  {
   "name": "r_meta",
   "index": 1,
   "hex": "8100"
  },
  {
   "name": "r_cyclic_meta",
   "index": 0,
   "hex": "8100"
  },
  {
   "name": "r_cyclic_meta",
   "index": 1,
   "hex": "8400"
  },
  {
   "name": "r_cyclic_meta",
   "index": 2,
   "hex": "7900"
  },
  {
   "name": "r_cyclic_meta",
   "index": 3,
   "hex": "7b00"
  },
  {
   "name": "r_mask",
   "index": 0,
   "hex": "94b011ac8988f374c1ded31d1fea2e1a550217d35cadfa6e373692300b6aae8f983a15e231a30e0494bca6159e1e00e988fc310ee90d392fd8c3a35d4fbdf71008b9287d5b734b99ae8d8ed7d7c51caaf57fc4376b1448299096746e7b083df1ce70a6f26e9e484df07b9ea2226cb1031b10c2cbc4c3c11f2d5841db03fca47f"
  },
  {
   "name": "lr",
   "index": 1,
   "value": 1
  },
  {
   "name": "lr",
   "index": 2,
   "value": 2
  },
  {
   "name": "lr",
   "index": 3,
   "value": 3
  },
  {
   "name": "lr",
   "index": 4,
   "value": 5
  },
  {
   "name": "lr",
   "index": 6,
   "value": 128
  },
  {
   "name": "lr",
   "index": 7,
   "value": 3
  },
  {
   "name": "cr",
   "index": 2,
   "value": 1
  },
  {
   "name": "cr",
   "index": 3,
   "value": 4
  },
  {
   "name": "cr",
   "index": 4,
   "value": 2
  },
  {
   "name": "cr",
   "index": 5,
   "value": 7
  },
  {
   "name": "cr",
   "index": 6,
   "value": 128
  },
  {
   "name": "cr",
   "index": 7,
   "value": 4294967294
  },
  {
   "name": "cr",
   "index": 8,
   "value": 100
  },
  {
   "name": "cr",
   "index": 9,
   "value": 3
  },
  {
   "name": "cr",
   "index": 11,
   "value": 1345076
  },
  {
   "name": "cr",
   "index": 14,
   "value": 328
  },
  {
   "name": "cr",
   "index": 15,
   "value": 4224
  }
 ],
 "xmem": []
}
