{
 "description": "ACTIVATE.QUANTIZE in FP32",
 "format": "fp32",
 "emulator_only": true,
 "max_cycles": 1000,
 "fault_enables": {},
 "registers": [
  {
   "name": "r_mask",
   "index": 0,
   "hex": "ffffffffffffffffffffffffffffffffffffffffffffffffffffffffffffffffffffffffffffffffffffffffffffffffffffffffffffffffffffffffffffffffffffffffffffffffffffffffffffffffffffffffffffffffffffffffffffffffffffffffffffffffffffffffffffffffffffffffffffffffffffffffffffffff"
  },
  {
   "name": "r_acc",
   "index": 0,
   "hex": "2f97f4c06720d14013c1e140430aadc0ff1e8e3fa19736c0906d86c0c525b6bea772d9c0bc65b53f560dba3f838afc3fbcfbea40fec6d4405af27640579007bf72f88640c583e240b9e5bb40bf52b2c032271c409018a0c009cfca40557c83409e593ebf36ceab40b438f840e822b9bf07b4484044ec34c043ada7bf7996b540319fae4064e48a40789628c0f828e0bf9997f13f2c1b374058d5dabf9425e8408af890c05feeff40df59ea40012481c0423d8cc09548b3402a828f40142ac540e6769f402a3fb0407da9c6c08a50e4c0515548c058409640a2c82d401709433e034b4bc0cf0a8a3f52fb58c0796ad8403929ecc0aafa2e40e32979c0c3868fc09fb5fb403202ecbc7962cfbf18bfcd40461afabf3e42993fb4dc29bf2b7d41c0c662f4bf34dc4ec0f32d2b405e7fa8c05c6aa4406735dac0566485c0d6f361c0c735c4405ba0af3f0e068bbf59608ec0a4cfd3c0ffce95c0e675aabf9a93bcbffe284dc0b86ebc40d5ccdbc0c44423c0b823ac401c2eeec0ba18bec045963b401b4febc02f39cfc091c1b7bf4106a0bf21820fc0b76a35be90e8cfbfe211d44017f694c0b23be3c05628abbff5f616408a45b1406503fd408e8bacbfb4afc4c0a47817c0a0cc9fc0f3e75e40dcfa90c09b1fb04075e5be3f39157cc08deafac091debfbf3f296dbf025eca3f2ddf4d3e675dbec0d9903dc08ccaa0c0c4fec3c0"
  },
  {
   "name": "aaq_lut",
   "index": 0,
   "hex": "6daba266c97f163d4fbb9ef05dad36fdc5ec5396e28fc2c81ba761a374a652565c7f96e1f96b1ca28d785cddd87ce0b34ffe3693c72291ad54de9afb382c1dd97eb0b47a7298c6817b7ba4c5d31a62ec207e244e876ff8b6d3acfa71b6ca4217e90c7acf63ffadc528a1d6a4c7d4b99fa404b717783c5d94def6f94b2b987787aad54e13dabc5317dbe1de554b1be3a53e8c81d26f3bd982a0983adf435675cbc2a4fdffa8652ad8913a3446b7663f00950385bf8d7edc4a775f763e2bd557042890593547e30def58ad354435d25f7e7d3f2b54843f9af8bb41ea7f02a66d3c7efa3b0c7eb6bd535dfc62e386c96467f80e09d320f58b78479b32e6c711dc5899ce395ef9682f8109bbedb1ea46e8534e27f0a105446fa20772927813a2ad60416a42e6ae801439c90070e0f45a1091e78c9332d3d3a00bbb2b06c480be67eb2038d4af471762db174406a6f31d8269fc15dd5cfa5870e3058899b08a342b5c6ebe70f59ac4a33d87c13a2411135e87f882f4f346ea0357ae9ca430d1bd2100cfff8e6e14ea6d2437a9622bf87c9d922b116feeaa8a56f2fb340ed49a318de2d27cf158675126acdba45bf88bdf660449dbe3a7531317ffb8eafa38d7abc9b3eab9342df16e3c4897ec90c7aa59302b43b4a5f2962ed28c5cc345afb39cf23f6cdcd68857496045e4538ae3b72bff9153aa21add719934074344db95afc1eff71a994451685d773f81b5f68d3c11c818a1c75330af2cf4377235ca28d967c5fc332d11d4712"
  },
  {
   "name": "lr",
   "index": 1,
   "value": 1
  },
  {
   "name": "lr",
   "index": 2,
   "value": 2
  },
  {
   "name": "lr",
   "index": 3,
   "value": 3
  },
  {
   "name": "lr",
   "index": 4,
   "value": 5
  },
  {
   "name": "lr",
   "index": 6,
   "value": 128
  },
  {
   "name": "lr",
   "index": 7,
   "value": 3
  },
  {
   "name": "cr",
   "index": 2,
   "value": 1
  },
  {
   "name": "cr",
   "index": 3,
   "value": 4
  },
  {
   "name": "cr",
   "index": 4,
   "value": 2
  },
  {
   "name": "cr",
   "index": 5,
   "value": 7
  },
  {
   "name": "cr",
   "index": 6,
   "value": 128
  },
  {
   "name": "cr",
   "index": 7,
   "value": 4294967294
  },
  {
   "name": "cr",
   "index": 8,
   "value": 100
  },
  {
   "name": "cr",
   "index": 9,
   "value": 3
  },
  {
   "name": "cr",
   "index": 11,
   "value": 1345076
  },
  {
   "name": "cr",
   "index": 14,
   "value": 328
  },
  {
   "name": "cr",
   "index": 15,
   "value": 4224
  }
 ],
 "xmem": []
}
