{
 "description": "ACC.ADD in E4",
 "format": "e4",
 "emulator_only": false,
 "max_cycles": 1000,
 "fault_enables": {},
 "registers": [
  {
   "name": "r_mask",
   "index": 0,
   "hex": "ffffffffffffffffffffffffffffffffffffffffffffffffffffffffffffffffffffffffffffffffffffffffffffffffffffffffffffffffffffffffffffffffffffffffffffffffffffffffffffffffffffffffffffffffffffffffffffffffffffffffffffffffffffffffffffffffffffffffffffffffffffffffffffffff"
  },
  {
   "name": "r_acc",
   "index": 0,
   "hex": "60d11340421537c0e38d8840c92e98c0e2f0cfc09f95624083bb213f01a7333ee6e2acc0138fe7409c6c06401ef8f34094b8e540dfdd14bf4f9b473facc5e13fb7a7dcbff066a1406115c940fe9c32be659fc3c0f8e0804055f1c7be021720c0aff310c0a87732c0030bd0bfe2ef783f6a40e4c09391c4409ea773c096f3d0c085dcc1407cd2b13f4e6888c05d0dfa3f5d683640fd648e408879e2406150cbc06e61a03f21a19440cb1f30400a89a1c01cc018c0f694913fd1acdac0ac7fa8c0dcbbf7bf4005f540a460b640917d843e3c43ec3f0d7f84407a4ad9405649964034fd7c3fe76b04c063bfd840b059dfc06e3ca73fda2fc23e0d005cc03d3edf40a201e440fd0a914045985e40077ea1404d662fbf5bfa483f703cdac0eb0fafc09abfc2c090fbd2403aaa8c4059a3bac0401763c0f9e1cbc0e12cf3406e9c8ec0b9bf4e4043705840d045ac4052955b3fb193afc0b27be4c043ca8a3fd5258540a826e7c096065cc0328ce540af553cc0414efa4000f2643ffe6c17bf7645ab40d68087bea659f1c03286c4c07cd6a5c02f77fd40e4ac8940cbba9640c201a3400cb8dec08efbd640e671ca40d7a689bf6fe550c0c012a0405aefbfc0c342a7c063473b402d9580c0bcf00340feb93d3f6ad69ac0d84754c0919750be02a39240aa301940a6568f40d863d6be8090a43df617a5c06d5d8640c81f9fc09195ef3f"
  },
  {
   "name": "lr",
   "index": 1,
   "value": 1
  },
  {
   "name": "lr",
   "index": 2,
   "value": 2
  },
  {
   "name": "lr",
   "index": 3,
   "value": 3
  },
  {
   "name": "lr",
   "index": 4,
   "value": 5
  },
  {
   "name": "lr",
   "index": 6,
   "value": 128
  },
  {
   "name": "lr",
   "index": 7,
   "value": 3
  },
  {
   "name": "cr",
   "index": 2,
   "value": 1
  },
  {
   "name": "cr",
   "index": 3,
   "value": 4
  },
  {
   "name": "cr",
   "index": 4,
   "value": 2
  },
  {
   "name": "cr",
   "index": 5,
   "value": 7
  },
  {
   "name": "cr",
   "index": 6,
   "value": 128
  },
  {
   "name": "cr",
   "index": 7,
   "value": 4294967294
  },
  {
   "name": "cr",
   "index": 8,
   "value": 100
  },
  {
   "name": "cr",
   "index": 9,
   "value": 3
  },
  {
   "name": "cr",
   "index": 15,
   "value": 128
  },
  {
   "name": "mult_res",
   "index": 0,
   "hex": "6400f2c0920f99c0ba92cbc0ec9d65406c3c763f1b8275c034ed05bf43418fc0bf57d8c0fd7fc2c0dac3dfc06f3ef9c0b72721407006e8409be0d9c0352582c07d74fac08a8a96bf5f1eccc08d36ecc0d940f940be24b93fad46e64052ed00c07195873dcaccedc0a3436f4073c8a1402b91db4017f25cc01c8dff40eb3e33c06248d4405434b4bf26d3e6402c686240867db240d561d13e5c5acd402e9bd8c0a6d989402021283f0ea6b0403e3e3040322a0f4044d9e03f4178a3400f1e814048d9f63e43b23640e59f9c40582e613f3fa885c01a1eacc03f1ca34028eab03e03f482c0508e82bfb66c9540fcbdb2bec77557c07c1cde40557eea40014561405a87eec040013a4013cfa53fb928e94046446b40c29a99403687b8c04c4b923e7e939e40f27796c003658b403cdf9f3f48f28dc01dc3f2c06cf041401db931408831fa40e7b0a2c02c127bc0a405df40e5f5bcc04305b7bfdee391bfd1f8d340e9fc49c0e124d940715686402b3bd3bf71a1adc0cccd84409361474061b2aec0c3e2ab40deaafdc04dfee93e033425404cb887c0dcdeed4008fa3fc0cc479e40e443af3de02d774013beccc0682243be3556ce40d0c2b740f93f5840da985ac0d8b97240948e90bf5063d2bf018dbcc0a2813f401718af4013393b409323acc02598a140cda90dc0c13fd040c8d231c0746c25c01356a340f37045c09712e740"
  }
 ],
 "xmem": []
}
